{
  "schemaVersion": 2,
  "launch": {
    "openBrowser": true,
    "channelReady": false,
    "codexBin": "codex",
    "profile": null,
    "providerProfile": "unmanaged-custom"
  },
  "storage": {
    "dataDir": null
  },
  "history": {
    "cleanup": {
      "enabled": false,
      "retention": {
        "enabled": false,
        "days": 90
      }
    },
    "library": {
      "enabled": true,
      "cacheLimitMiB": 512,
      "sources": []
    }
  }
}
